Fraktion;Ausrüstung;Punkte;Beschreibung
Adeptus Astartes;Tarnmantel;1;Wenn ein Gegner einen Trefferwurf für eine Fernkampfattacke durchführt, die ein mit einem Tarnmatel ausgerüsteten Model als Ziel hat und das Zielmodell verdeckt ist, erleidet dieser Trefferwurf einen zusätzlichen Modifikator von -1.
Adeptus Astartes;Auspex;1;"zu Begin deiner Fernkampfphase kannst du ein andees Model der ADEPTUS ASTARTES innerhalb von 3"" um ein befreundetes, mit einem Auspex ausgerüstetes und nicht erschüttertes Modell wählen. Das gewählte Modell erleidet keine negativen Modifikationen auf seine Treffer- und Verletzungswürfe dadurch, dass sein Ziel verdeckt ist."
Adeptus Astartes;Gravschirm;1;"Ein Modell mit einem Gravschirm erleidet niemals Sturzschaden und fällt niemals auf ein anderes Modell. Wenn es dies würde, platziere stattdessen dieses Modell so nah wie möglich an dem Punkt an dem es gelandet wäre. Dies darf dazu führen, dass es sich innerhalb von 1"" um ein feindliches Modell steht."
Adeptus Astartes;Greifhakenwerfer;1;Ein Modell mit einem Greifhakenwerfen kann jede Distanz vertikal (nach oben oder unten) erklettern, wenn es eine normale Bewegung ausführt - miss die auf diese Art bewegte Entfernung nicht ab.
Adeptus Astartes;Unterlauf Granatwerfer;0;"Erhöhe die Reichweite aller Granaten, die ein mit einem Unterlauf-Granatwerfer bewaffnetes Modell besitzt, auf 30""."
